<?xml version="1.0" encoding="UTF-8"?>
<?xml-stylesheet href="concesionario.xsl" type="text/xsl"?>
<vehiculos  xmlns:xsi="http://www.w3.org/2001/XMLSchema-instance" xsi:noNamespaceSchemaLocation="concesionario.xsd">
<coches>
<coche>
<id_serie>1</id_serie>
<matricula>5432LKJ</matricula>
<numero_bastidor>1A8S7F6G7F9D9G8F8</numero_bastidor>
<color>Azul</color>
<numero_asientos>5</numero_asientos>
<precio>20000</precio>
<marca>Ford</marca>
<modelo>Mondeo</modelo>
<fecha_fabricacion>2011-04-22</fecha_fabricacion>
<numero_puertas>5</numero_puertas>
<capacidad_maletero>10</capacidad_maletero>
</coche>
<coche>
<id_serie>2</id_serie>
<matricula>5232LKJ</matricula>
<numero_bastidor>4D3J4F6G7F9D9G8F8</numero_bastidor>
<color>Negro</color>
<numero_asientos>5</numero_asientos>
<precio>23200</precio>
<marca>Ford</marca>
<modelo>Fiesta</modelo>
<fecha_fabricacion>2011-04-22</fecha_fabricacion>
<numero_puertas>5</numero_puertas>
<capacidad_maletero>10</capacidad_maletero>
</coche>
</coches>
<camiones>
<camion>
<id_serie>3</id_serie>
<matricula>8566HKJ</matricula>
<numero_bastidor>1A8S7F6G7F9D2J4NM</numero_bastidor>
<color>Blanco</color>
<numero_asientos>2</numero_asientos>
<precio>23200</precio>
<marca>Renault</marca>
<modelo>Magnum</modelo>
<fecha_fabricacion>2002-04-22</fecha_fabricacion>
<carga>5</carga>
<tipo_mercancia>G</tipo_mercancia>
</camion>
<camion>
<id_serie>3</id_serie>
<matricula>8126HKJ</matricula>
<numero_bastidor>1A8S7F6G7F7H6J4NM</numero_bastidor>
<color>Rojo</color>
<numero_asientos>2</numero_asientos>
<precio>25000</precio>
<marca>Renault</marca>
<modelo>Magnum</modelo>
<fecha_fabricacion>2002-04-22</fecha_fabricacion>
<carga>5</carga>
<tipo_mercancia>A</tipo_mercancia>
</camion>
</camiones>
</vehiculos>